{
  "apiVersion": "liveshop.io/v1",
  "kind": "ModuleRelease",
  "metadata": {
    "id": "platform",
    "name": "Platform Control Plane",
    "version": "5.1.0"
  },
  "spec": {
    "backend": {
      "service": "platform",
      "origin": "http://127.0.0.1:18082",
      "httpRoutes": [
        {
          "surface": "admin",
          "prefix": "/admin/platform/registry",
          "operations": [
            {
              "id": "platform.admin.registry.modules.list",
              "method": "GET",
              "path": "/admin/platform/registry/modules",
              "summary": "查询模块生命周期",
              "description": "返回模块、不可变发布、摘要和当前激活版本。",
              "authentication": "module-session",
              "idempotency": "safe",
              "requiredPermissions": [
                "platform.registry.manage"
              ],
              "requestFields": [],
              "responses": [
                {
                  "status": 200,
                  "description": "模块发布列表",
                  "fields": [
                    {
                      "name": "items",
                      "type": "array",
                      "description": "模块数组"
                    }
                  ]
                }
              ]
            },
            {
              "id": "platform.admin.registry.capabilities.list",
              "method": "GET",
              "path": "/admin/platform/registry/capabilities",
              "summary": "查询模块能力目录",
              "description": "返回所有不可变发布的 HTTP、gRPC、权限和前端能力契约。",
              "authentication": "module-session",
              "idempotency": "safe",
              "requiredPermissions": [
                "platform.registry.manage"
              ],
              "requestFields": [],
              "responses": [
                {
                  "status": 200,
                  "description": "机器可读能力目录",
                  "fields": [
                    {
                      "name": "revision",
                      "type": "integer",
                      "description": "注册中心修订号"
                    },
                    {
                      "name": "items",
                      "type": "array",
                      "description": "模块能力数组"
                    }
                  ]
                }
              ]
            },
            {
              "id": "platform.admin.registry.modules.activate",
              "method": "POST",
              "path": "/admin/platform/registry/modules/{moduleId}/activate",
              "summary": "激活模块版本",
              "description": "在串行化事务中校验路由冲突和活动导航分组元数据一致性、同步权限目录、更新唯一激活版本并记录审计。",
              "authentication": "module-session",
              "idempotency": "idempotent",
              "requiredPermissions": [
                "platform.registry.manage"
              ],
              "requestFields": [
                {
                  "name": "moduleId",
                  "location": "path",
                  "type": "string",
                  "required": true,
                  "description": "模块 ID"
                },
                {
                  "name": "version",
                  "location": "body",
                  "type": "string",
                  "required": true,
                  "description": "发布版本"
                }
              ],
              "responses": [
                {
                  "status": 200,
                  "description": "激活完成",
                  "fields": []
                },
                {
                  "status": 409,
                  "description": "发布不存在、路由冲突或导航分组元数据冲突",
                  "fields": [
                    {
                      "name": "message",
                      "type": "string",
                      "description": "冲突原因"
                    }
                  ]
                }
              ]
            },
            {
              "id": "platform.admin.registry.modules.deactivate",
              "method": "DELETE",
              "path": "/admin/platform/registry/modules/{moduleId}/deactivate",
              "summary": "停用模块",
              "description": "移除模块当前激活版本并记录审计；Platform 自身不可停用。",
              "authentication": "module-session",
              "idempotency": "idempotent",
              "requiredPermissions": [
                "platform.registry.manage"
              ],
              "requestFields": [
                {
                  "name": "moduleId",
                  "location": "path",
                  "type": "string",
                  "required": true,
                  "description": "模块 ID"
                }
              ],
              "responses": [
                {
                  "status": 204,
                  "description": "停用完成",
                  "fields": []
                },
                {
                  "status": 404,
                  "description": "模块未激活",
                  "fields": [
                    {
                      "name": "message",
                      "type": "string",
                      "description": "错误原因"
                    }
                  ]
                }
              ]
            }
          ]
        },
        {
          "surface": "admin",
          "prefix": "/admin/platform/settings",
          "operations": [
            {
              "id": "platform.admin.settings.catalog.get",
              "method": "GET",
              "path": "/admin/platform/settings/catalog",
              "summary": "查询配置分类及表单元数据",
              "description": "返回 Platform 拥有的配置分组、子类和字段 schema。直播/交易/注册等业务配置不进入本目录。Admin 按字段渲染表单，不自行维护 JSON 结构。",
              "authentication": "module-session",
              "idempotency": "safe",
              "requiredPermissions": [
                "platform.settings.read"
              ],
              "requestFields": [],
              "responses": [
                {
                  "status": 200,
                  "description": "分类目录",
                  "fields": [
                    {
                      "name": "groups",
                      "type": "array",
                      "description": "大类→子类→字段，不含密钥"
                    }
                  ]
                }
              ]
            },
            {
              "id": "platform.admin.settings.list",
              "method": "GET",
              "path": "/admin/platform/settings",
              "summary": "查询平台配置",
              "description": "返回当前租户的平台配置文档。",
              "authentication": "module-session",
              "idempotency": "safe",
              "requiredPermissions": [
                "platform.settings.read"
              ],
              "requestFields": [],
              "responses": [
                {
                  "status": 200,
                  "description": "配置文档列表",
                  "fields": [
                    {
                      "name": "items",
                      "type": "array",
                      "description": "配置文档"
                    }
                  ]
                }
              ]
            },
            {
              "id": "platform.admin.settings.get",
              "method": "GET",
              "path": "/admin/platform/settings/{namespace}",
              "summary": "读取命名空间配置",
              "description": "读取指定 namespace 的版本化配置文档。",
              "authentication": "module-session",
              "idempotency": "safe",
              "requiredPermissions": [
                "platform.settings.read"
              ],
              "requestFields": [
                {
                  "name": "namespace",
                  "location": "path",
                  "type": "string",
                  "required": true,
                  "description": "配置命名空间"
                }
              ],
              "responses": [
                {
                  "status": 200,
                  "description": "配置文档",
                  "fields": [
                    {
                      "name": "value",
                      "type": "object",
                      "description": "配置值"
                    },
                    {
                      "name": "version",
                      "type": "integer",
                      "description": "当前版本"
                    }
                  ]
                }
              ]
            },
            {
              "id": "platform.admin.settings.update",
              "method": "PUT",
              "path": "/admin/platform/settings/{namespace}",
              "summary": "写入命名空间配置",
              "description": "使用 expectedVersion 乐观锁写入已登记 namespace 的配置值。字段必须属于 catalog，禁止自由 JSON 和密钥键。",
              "authentication": "module-session",
              "idempotency": "idempotent",
              "requiredPermissions": [
                "platform.settings.write"
              ],
              "requestFields": [
                {
                  "name": "namespace",
                  "location": "path",
                  "type": "string",
                  "required": true,
                  "description": "配置命名空间"
                },
                {
                  "name": "expectedVersion",
                  "location": "body",
                  "type": "integer",
                  "required": true,
                  "description": "期望版本"
                },
                {
                  "name": "value",
                  "location": "body",
                  "type": "object",
                  "required": true,
                  "description": "配置值"
                }
              ],
              "responses": [
                {
                  "status": 200,
                  "description": "最新配置文档",
                  "fields": [
                    {
                      "name": "version",
                      "type": "integer",
                      "description": "最新版本"
                    }
                  ]
                },
                {
                  "status": 409,